{
  "$schema": "http://json-schema.org/draft-07/schema#",
  "title": "GitHub Housekeeping Configuration",
  "type": "object",
  "additionalProperties": false,
  "properties": {
    "$schema": {
      "type": "string"
    },
    "ApiBaseUrl": {
      "type": [
        "string",
        "null"
      ]
    },
    "Repository": {
      "type": [
        "string",
        "null"
      ]
    },
    "Token": {
      "type": [
        "string",
        "null"
      ]
    },
    "TokenEnvName": {
      "type": "string"
    },
    "DryRun": {
      "type": "boolean"
    },
    "Artifacts": {
      "type": "object",
      "additionalProperties": false,
      "properties": {
        "Enabled": { "type": "boolean" },
        "IncludeNames": {
          "type": "array",
          "items": { "type": "string" }
        },
        "ExactIncludeNames": {
          "type": "array",
          "items": { "type": "string" }
        },
        "ExcludeNames": {
          "type": "array",
          "items": { "type": "string" }
        },
        "KeepLatestPerName": { "type": "integer", "minimum": 0 },
        "MaxAgeDays": {
          "type": [
            "integer",
            "null"
          ],
          "minimum": 1
        },
        "MaxDelete": { "type": "integer", "minimum": 1 },
        "PageSize": { "type": "integer", "minimum": 1, "maximum": 100 },
        "FailOnDeleteError": { "type": "boolean" }
      }
    },
    "Caches": {
      "type": "object",
      "additionalProperties": false,
      "properties": {
        "Enabled": { "type": "boolean" },
        "IncludeKeys": {
          "type": "array",
          "items": { "type": "string" }
        },
        "ExcludeKeys": {
          "type": "array",
          "items": { "type": "string" }
        },
        "KeepLatestPerKey": { "type": "integer", "minimum": 0 },
        "MaxAgeDays": {
          "type": [
            "integer",
            "null"
          ],
          "minimum": 1
        },
        "MaxDelete": { "type": "integer", "minimum": 1 },
        "PageSize": { "type": "integer", "minimum": 1, "maximum": 100 },
        "FailOnDeleteError": { "type": "boolean" }
      }
    },
    "Runner": {
      "type": "object",
      "additionalProperties": false,
      "properties": {
        "Enabled": { "type": "boolean" },
        "RunnerTempPath": {
          "type": [
            "string",
            "null"
          ]
        },
        "WorkRootPath": {
          "type": [
            "string",
            "null"
          ]
        },
        "RunnerRootPath": {
          "type": [
            "string",
            "null"
          ]
        },
        "DiagnosticsRootPath": {
          "type": [
            "string",
            "null"
          ]
        },
        "ToolCachePath": {
          "type": [
            "string",
            "null"
          ]
        },
        "DotNetRootPath": {
          "type": [
            "string",
            "null"
          ]
        },
        "MinFreeGb": {
          "type": [
            "integer",
            "null"
          ],
          "minimum": 1
        },
        "AggressiveThresholdGb": {
          "type": [
            "integer",
            "null"
          ],
          "minimum": 1
        },
        "DiagnosticsRetentionDays": { "type": "integer", "minimum": 0 },
        "ActionsRetentionDays": { "type": "integer", "minimum": 0 },
        "WorkspacesRetentionDays": { "type": "integer", "minimum": 0 },
        "ToolCacheRetentionDays": { "type": "integer", "minimum": 0 },
        "DotNetSdkVersionsToKeepPerMajorMinor": { "type": "integer", "minimum": 1 },
        "Aggressive": { "type": "boolean" },
        "CleanDiagnostics": { "type": "boolean" },
        "CleanRunnerTemp": { "type": "boolean" },
        "CleanActionsCache": { "type": "boolean" },
        "CleanWorkspaces": { "type": "boolean" },
        "CleanToolCache": { "type": "boolean" },
        "ClearDotNetCaches": { "type": "boolean" },
        "PruneDotNetSdks": {
          "type": "boolean",
          "description": "Prunes superseded unowned stable SDKs during aggressive cleanup on Linux and Windows runners."
        },
        "CleanWindowsComponentStore": {
          "type": "boolean",
          "description": "Runs non-resetting DISM component-store cleanup during aggressive cleanup on Windows runners."
        },
        "PruneDocker": { "type": "boolean" },
        "IncludeDockerVolumes": { "type": "boolean" },
        "AllowSudo": { "type": "boolean" }
      }
    }
  }
}
