{
  "$schema": "https://raw.githubusercontent.com/EvotecIT/PSPublishModule/main/Schemas/github.housekeeping.schema.json",
  "Repository": "EvotecIT/PSPublishModule",
  "TokenEnvName": "GITHUB_TOKEN",
  "Artifacts": {
    "Enabled": false
  },
  "Caches": {
    "Enabled": false
  },
  "Runner": {
    "Enabled": true,
    "MinFreeGb": 20,
    "DiagnosticsRetentionDays": 14,
    "ActionsRetentionDays": 7,
    "WorkspacesRetentionDays": 0,
    "CleanWorkspaces": true,
    "ClearDotNetCaches": false,
    "PruneDocker": false,
    "IncludeDockerVolumes": false,
    "ToolCacheRetentionDays": 30,
    "PruneDotNetSdks": true,
    "DotNetSdkVersionsToKeepPerMajorMinor": 1,
    "CleanWindowsComponentStore": true
  }
}
